from,url,text
https://www.hessen.de/regierung/politisches-system,http://www.hessischer-landtag.de,Mehr
https://www.hessen.de/regierung/partner,http://www.hessen-agentur.de/dynasite.cfm?dsmid=18822,Mehr
https://www.hessen.de/regierung/ministerpraesident,https://70gg.wordpress.com/2019/03/28/volker-bouffier/,Mehr
https://www.hessen.de/regierung/podcast,http://open.spotify.com/show/2PyAPbnmzpAo7D7Py2H0tb,Auf Spotify abspielen
https://www.hessen.de/regierung/podcast,https://soundcloud.com/landhessen,LandHessen
https://www.hessen.de/regierung/podcast,https://soundcloud.com/landhessen/corona-hat-der-digitalisierung/s-j7kgSWukXGx,Corona hat der Digitalisierung einen Schub gegeben
https://www.hessen.de/regierung/podcast,https://soundcloud.com/landhessen/nach-sieben-im-hotel-rose-die-landesregierung-informiert/s-nDzlkCNU6Cp,Finanzielle Hilfen in Corona-Zeiten. Michael Boddenberg rockt das Finanzministerium
https://www.hessen.de/regierung/podcast,https://soundcloud.com/landhessen/20-07-10-podcast-hinz-final/s-7n6qdUhUIUJ,Reiseland Hessen immer beliebter: Umweltministerin Hinz über die Sehnsucht nach Erholung und Natur!
https://www.hessen.de/regierung/podcast,https://soundcloud.com/landhessen/europaministerin-lucia-puttrich-die-botschafterin-hessens-in-berlin-und-brussel/s-xshu02FzhWq,Europaministerin Lucia Puttrich: Die Botschafterin Hessens in Berlin und Brüssel
https://www.hessen.de/regierung/podcast,https://soundcloud.com/landhessen/wer-halt-die-faden-in-der-hand-staatskanzlei-chef-wintermeyer-stellt-die-regierungszentrale-vor,Wer hält die Fäden in der Hand? Staatskanzlei-Chef Wintermeyer stellt die Regierungszentrale vor
https://www.hessen.de/regierung/podcast,https://open.spotify.com/show/2PyAPbnmzpAo7D7Py2H0tb,Auf Spotify abspielen
https://www.hessen.de/regierung/podcast,https://soundcloud.com/landhessen/hessen-stellt-sich-gegen-hetze-im-netz-justizministerin-kuhne-hormann-im-gesprach,Hessen stellt sich gegen Hetze im Netz: Justizministerin Kühne-Hörmann im Gespräch (Episode 6)
https://www.hessen.de/regierung/podcast,https://soundcloud.com/landhessen/kommunikation-im-krisenmodus-ein-gesprach-mit-regierungssprecher-michael-buser-episode-5/s-6J0u0fpH5m9,Kommunikation im Krisenmodus: Ein Gespräch mit Regierungssprecher Michael Bußer (Episode 5)
https://www.hessen.de/regierung/podcast,https://soundcloud.com/landhessen/20-04-30-podcast-lorz-final-mastered,Nach dem Lockdown: Schritt für Schritt zurück auf die Schulbank mit Kultusminister Lorz (Episode 2)
https://www.hessen.de/regierung/podcast,https://soundcloud.com/landhessen/nach-sieben-im-hotel-rose-die-landesregierung-informiert-episode-2/s-ZkmnNP5afLx,Ein Blick in das geheime Vorratslager für Schutzausrüstung mit Innenminister Peter Beuth (Episode 1)
